DOI,PMID,arXiv ID,Title,Abstract,Authors,Journal,Year
10.1103/physreve.57.6345,,,How self-organized criticality works: A unified mean-field picture,"We present a unified dynamical mean-field theory, based on the single site approximation to the master-equation, for stochastic self-organized critical models. In particular, we analyze in detail the properties of sandpile and forest-fire (FF) models. In analogy with other nonequilibrium critical phenomena, we identify an order parameter with the density of ``active'' sites, and control parameters with the driving rates. Depending on the values of the control parameters, the system is shown to reach a subcritical (absorbing) or supercritical (active) stationary state. Criticality is analyzed in terms of the singularities of the zero-field susceptibility. In the limit of vanishing control parameters, the stationary state displays scaling characteristics of self-organized criticality (SOC). We show that this limit corresponds to the breakdown of space-time locality in the dynamical rules of the models. We define a complete set of critical exponents, describing the scaling of order parameter, response functions, susceptibility and correlation length in the subcritical and supercritical states. In the subcritical state, the response of the system to small perturbations takes place in avalanches. We analyze their scaling behavior in relation with branching processes. In sandpile models, because of conservation laws, a critical exponents subset displays mean-field values $(\ensuremath{\nu}=$$\frac{1}{2}$ and $\ensuremath{\gamma}=1)$ in any dimensions. We treat bulk and boundary dissipation and introduce a critical exponent relating dissipation and finite size effects. We present numerical simulations that confirm our results. In the case of the forest-fire model, our approach can distinguish between different regimes (SOC-FF and deterministic FF) studied in the literature, and determine the full spectrum of critical exponents.","Alessandro Vespignani,Alessandro Vespignani,Stefano Zapperi,Stefano Zapperi",Physical Review E,1998
10.1016/0167-2789(88)90062-0,,,Singular perturbation theory of traveling waves in excitable media (a review),"Abstract   Waves of chemical or electrical activity, traveling through space, have been observed in several contexts: chemical reaction mixtures in non-convecting liquid phase, cell suspensions, nerve axons, and neuromuscular tissues. Typically, wave-supporting preparations are excitable; that is, they respond and sensitivity to perturbations are rapidly damped out, but suprathreshold disturbances trigger an abrupt and substantial response. The abruptness of the response can be exploited by the methods of singular perturbation theory to obtain a mathematical description of wave propagation in spatially distributed excitable media. Singular perturbation analysis of propagating waves in one spatial dimension is straightforward and uncontentious, but the analysis of propagating waves in one spatial dimension is straightforward and several fundamentally different ways. We compare and contrast the approaches taken by Greenberg, Zykov, Fife, Krinskii and his collaborators, and ourselves, with particular emphasis on the case of rotating spiral waves. Our intention is to bring some order to the important but difficult theory of propagating waves in two-dimensional excitable media. In conclusion we discuss briefly some possible extensions of the singular perturbation approach to propagating wave surfaces in three-dimensional space.","John J. Tyson,John J. Tyson,James P. Keener,James P. Keener",Physica D: Nonlinear Phenomena,1988
10.1016/0378-4371(95)00441-6,,,Critical properties of the one-dimensional forest-fire model,"A one-dimensional forest-fire model including lightnings is studied numerically and analytically. For the tree correlation function, a new correlation length with critical exponent v ≈ 56 is found by simulations. A Hamiltonian formulation is introduced which enables one to study the stationary state close to the critical point using quantum-mechanical perturbation theory. With this formulation also the structure of the low-lying relaxation spectrum and the critical behaviour of the smallest complex gap are investigated numerically. Finally, it is shown that critical correlation functions can be obtained from a simplified model involving only the total number of trees although such simplified models are unable to reproduce the correct off-critical behaviour.","A. Honecker,Andreas Honecker,Ingo Peschel,I. Peschel,Ingo Peschel",Physica A-statistical Mechanics and Its Applications,1996
10.1103/physreve.53.414,9964272,,"Avalanche dynamics in evolution, growth, and depinning models","Dynamics of complex systems in nature often occurs in terms of punctuations, or avalanches, rather than following a smooth, gradual path. Theory of avalanche dynamics in models of growth, interface depinning, and evolution is presented. Specifically, we include the Bak-Sneppen evolution model, Sneppen interface depinning model, Zaitsev flux creep model, invasion percolation, and several other depinning models into a unified treatment encompassing a large class of far from equilibrium processes. The formation of fractal structures, the appearance of 1/{ital f} noise, diffusion with anomalous Hurst exponents, L{acute e}vy flights, and punctuated equilibria can all be related to the same underlying avalanche dynamics. This dynamics can be represented as a fractal in {ital d} spatial plus one temporal dimension. The complex state can be reached either by tuning a parameter, or it can be self-organized. We present two {ital exact} equations for the avalanche behavior in the latter case. (1) The slow approach to the critical attractor, i.e., the process of self-organization, is governed by a ``gap`` equation for divergence of avalanche sizes. (2) The hierarchical structure of avalanches is described by an equation for the average number of sites covered by an avalanche. The exponent {gamma} governing the approach tomore» the critical state appears as a constant rather than as a critical exponent. In addition, the conservation of activity in the stationary state manifests itself through the superuniversal result {eta}=0. The exponent {pi} for the L{acute e}vy flight jumps between subsequent active sites can be related to other critical exponents through a study of {open_quote}{open_quote}backward avalanches.{close_quote}{close_quote} We develop a scaling theory that relates many of the critical exponents in this broad category of extremal models, representing different universality classes, to two basic exponents characterizing the fractal attractor. (Abstract Truncated)«less","Maya Paczuski,Maya Paczuski,Sergei Maslov,Sergei Maslov,Per Bak,Per Bak",Physical Review E,1996
10.1103/physrevlett.74.742,10058836,,Self-Organized Criticality in Nonconserved Systems.,"The origin of self-organized criticality in a model without conservation law (Olami, Feder, and Christensen, Phys. Rev. Lett. 68, 1244 (1992)) is studied. The homogeneous system with periodic boundary condition is found to be periodic and neutrally stable. A change to open boundaries results in the invasion of the interior by a “self-organized” region. The mechanism for the self-organization is closely related to the synchronization or phase-locking of the individual elements with each other. A simplified model of marginal oscillator locking on a directed lattice is used to explain many of the features in the non-conserved model: in particular, the dependence of the avalanche","A. Alan Middleton,A. Alan Middleton,Chao Tang,Chao Tang",Physical Review Letters,1995
10.4324/9780203931950-20,,,The morphology of landscape,"The objects which exist together in the landscape
exist in interrelation. We assert that they constitute
a reality as a whole that is not expressed by aregionalist tradition that described the dynamic interaction between humans and their environment from a longterm historical perspective. As a graduate student at the University of Chicago, Sauer had attended Semple’s
lectures, but he came to view the idea of environmental determinants of human behavior as unfounded 
scientifically and even questionable morally. Sauer felt that the evidence supported a view that did not hold
nature constant, but regarded “the scene” of human action (that is, the human-environment relationship) as
constantly changing.","Carl O. Sauer,Carl O. Sauer",,1925
10.1515/znc-1994-11-1222,,,"Intersexual transfer of a toxic terpenoid during copulation and its paternal allocation to developmental stages - quantification of cantharidin in cantharidin-producing oedemerids (Coleoptera, Oedemeridae) and Canthariphilous pyrochroids (Coleoptera, Pyrochroidae)","In whole body extracts of the canthariphilous pyrochroid Schizotus pectinicornis and the cantharidin-producing oedemerid Oedemera femorata cantharidin contents were determined by means of quantitative gas chromatography. Adults and all developmental stages of both species contain this terpenoid, but in considerably different amounts. Cantharidin contents differ significantly between the sexes of adult O. femorata: 8.4 μ,g/female, 3.5 μg/male. Values for Sch. pectinicornis are more than 30-fold lower than those of O. femorata and no intersexual difference in the cantharidin content could be detected. Eggs of O. femorata contained cantharidin and larvae of this species are capable of synthesizing this terpenoid. The total amount of cantharidin increases in successive instars. In Sch. pectinicornis, the content of cantharidin decreases from egg to first instar. Feeding and copulation experiments with [ 2 H 2 ]cantharidin indicate that in O. femorata no or only very small amounts of cantharidin are transferred from males to females at copulation. Thus, males do not invest in the protection of their offspring by cantharidin gifts to the mate. For Sch. pectinicornis an intersexual transfer of labelled cantharidin during copulation was detected. About 45% of the entire cantharidin content in mated females derived from fed males. Analyses of eggs and first instar larvae show that a paternal allocation of 2 [H 2 ]cantharidin to developmental stages exists for this canthariphilous pyrochroid.","Chris Holt,C. Holt,G. Streil,G. Streil,Konrad Dettner,Konrad Dettner,J. Dütemeyer,J. Dutemeyer,Wilhelm Boland,Wilhelm Boland",Zeitschrift für Naturforschung C,1994
10.1016/j.physa.2015.11.022,,,Rise of an alternative majority against opinion leaders,"We investigate the role of opinion leaders or influentials in the collective behavior of a social system. Opinion leaders are characterized by their unidirectional influence on other agents. We employ a model based on Axelrod’s dynamics for cultural interaction among social agents that allows for non-interacting states. We find three collective phases in the space of parameters of the system, given by the fraction of opinion leaders and a quantity representing the number of available states: one ordered phase having the state imposed by the leaders; another nontrivial ordered phase consisting of a majority group in a state orthogonal or alternative to that of the opinion leaders, and a disordered phase, where many small groups coexist. We show that the spontaneous rise of an alternative group in the presence of opinion leaders depends on the existence of a minimum number of long-range connections in the underlying network. This phenomenon challenges the common idea that influentials are fundamental to propagation processes in society, such as the formation of public opinion.","K. Tucci,K. Tucci,Juan Carlos González-Avella,Juan Carlos González-Avella,M. G. Cosenza,Mario G. Cosenza",Physica A-statistical Mechanics and Its Applications,2016
10.1371/journal.pone.0016939,21483665,,Geographic Constraints on Social Network Groups,"Social groups are fundamental building blocks of human societies. While our social interactions have always been constrained by geography, it has been impossible, due to practical difficulties, to evaluate the nature of this restriction on social group structure. We construct a social network of individuals whose most frequent geographical locations are also known. We also classify the individuals into groups according to a community detection algorithm. We study the variation of geographical span for social groups of varying sizes, and explore the relationship between topological positions and geographic positions of their members. We find that small social groups are geographically very tight, but become much more clumped when the group size exceeds about 30 members. Also, we find no correlation between the topological positions and geographic positions of individuals within network communities. These results suggest that spreading processes face distinct structural and spatial constraints.","Jukka‐Pekka Onnela,Jukka-Pekka Onnela,Samuel Arbesman,Samuel Arbesman,Marta C. González,Marta C. González,Albert‐László Barabási,Albert-László Barabási,Nicholas A. Christakis,Nicholas A. Christakis",PLOS ONE,2011
,,,LCPFCT-A Flux-Corrected Transport Algorithm for Solving Generalized Continuity Equations,"Abstract : Flux-Corrected Transport has proven to be an accurate and easy to use an algorithm to solve nonlinear, time-dependent continuity equations of the type which occur in fluid dynamics, reactive, multiphase, and elastic plastic flows, plasmadynamics, and magnetohydrodynamics. This report updates and supersedes a previous report entitled Flux-Corrected Transport Modules for Solving Generalized Continuity Equations. It can be used as a user manual for subroutines and test programs included in the appendices. The entire LCPFCT library in its most recent from is presented and discussed in detail. There are, in addition, discussions of more general topics such as the application of physical boundary conditions, physical positivity and numerical diffusion which help to put the numerical aspects to this subroutine library in context.","J. P. Boris,Jay P. Boris,Alexandra Landsberg,Alexandra Landsberg,Elaine S. Oran,Elaine S. Oran,John Gardner,John H. Gardner,John H. Gardner,John H. Gardner",,1993
10.1016/0370-1573(74)90023-4,,,The Renormalization group and the epsilon expansion,"The modern formulation of the renormalization group is explained for both critical phenomena in classical statistical mechanics and quantum field theory. The expansion in ϵ = 4− d is explained [ d is the dimension of space (statistical mechanics) or space-time (quantum field theory)]. The emphasis is on principles, not particular applications. Sections 1–8 provide a self-contained introduction at a fairly elementary level to the statistical mechanical theory. No background is required except for some prior experience with diagrams. In particular, a diagrammatic approximation to an exact renormalization group equation is presented in sections 4 and 5; sections 6–8 include the approximate renormalization group recursion formula and the Feyman graph method for calculating exponents. Sections 10–13 go deeper into renormalization group theory (section 9 presents a calculation of anomalous dimensions). The equivalence of quantum field theory and classical statistical mechanics near the critical point is established in section 10; sections 11–13 concern problems common to both subjects. Specific field theoretic references assume some background in quantum field theory. An exact renormalization group equation is presented in section 11; sections 12 and 13 concern fundamental topological questions.","Kenneth G. Wilson,Kenneth G. Wilson,John B. Kogut,John B. Kogut",Physics Reports,1973
,,,Model and theoretical seismicity,"abstract   A laboratory and a numerical model have been constructed to explore the role of friction along a fault as a factor in the earthquake mechanism. The laboratory model demonstrates that small shocks are necessary to the loading of potential energy into the focal structure; a large part, but not all, of the stored potential energy is later released in a major shock, at the end of a period of loading energy into the system. By the introduction of viscosity into the numerical model, aftershocks take place following a major shock. Both models have features which describe the statistics of shocks in the main sequence, the statistics of aftershocks and the energy-magnitude scale, among others.","Robert Burridge,R. Burridge,L. Knopoff,Leon Knopoff,L. Knopoff",Bulletin of the Seismological Society of America,1967
,,,Fractals and Disordered Systems,"1 Fractals and Multifractals: The Interplay of Physics and Geometry (With 30 Figures).- 1.1 Introduction.- 1.2 Nonrandom Fractals.- 1.3 Random Fractals: The Unbiased Random Walk.- 1.4 The Concept of a Characteristic Length.- 1.5 Functional Equations and Fractal Dimension.- 1.6 An Archetype: Diffusion Limited Aggregation.- 1.7 DLA: Fractal Properties.- 1.8 DLA: Multifractal Properties.- 1.8.1 General Considerations.- 1.8.2 ""Phase Transition"" in 2d DLA.- 1.8.3 The Void-Channel Model of 2d DLA Growth.- 1.8.4 Multifractal Scaling of 3d DLA.- 1.9 Scaling Properties of the Perimeter of 2d DLA: The ""Glove"" Algorithm.- 1.9.1 Determination of the l Perimeter.- 1.9.2 The l Gloves.- 1.9.3 Necks and Lagoons.- 1.10 Multiscaling.- 1.11 The DLA Skeleton.- 1.12 Applications of DLA to Fluid Mechanics.- 1.12.1 Archetype 1: The Ising Model and Its Variants.- 1.12.2 Archetype 2: Random Percolation and Its Variants.- 1.12.3 Archetype 3: The Laplace Equation and Its Variants.- 1.13 Applications of DLA to Dendritic Growth.- 1.13.1 Fluid Models of Dendritic Growth.- 1.13.2 Noise Reduction.- 1.13.3 Dendritic Solid Patterns: ""Snow Crystals"".- 1.13.4 Dendritic Solid Patterns: Growth of NH4Br.- 1.14 Other Fractal Dimensions.- 1.14.1 The Fractal Dimension dw of a Random Walk.- 1.14.2 The Fractal Dimension dmin ? 1/?? of the Minimum Path.- 1.14.3 Fractal Geometry of the Critical Path: ""Volatile Fractals"".- 1.15 Surfaces and Interfaces.- 1.15.1 Self-Similar Structures.- 1.15.2 Self-Affine Structures.- 1.A Appendix: Analogies Between Thermodynamics and Multifractal Scaling.- References.- 2 Percolation I (With 24 Figures).- 2.1 Introduction.- 2.2 Percolation as a Critical Phenomenon.- 2.3 Structural Properties.- 2.4 Exact Results.- 2.4.1 One-Dimensional Systems.- 2.4.2 The Cayley Tree.- 2.5 Scaling Theory.- 2.5.1 Scaling in the Infinite Lattice.- 2.5.2 Crossover Phenomena.- 2.5.3 Finite-Size Effects.- 2.6 Related Percolation Problems.- 2.6.1 Epidemics and Forest Fires.- 2.6.2 Kinetic Gelation.- 2.6.3 Branched Polymers.- 2.6.4 Invasion Percolation.- 2.6.5 Directed Percolation.- 2.7 Numerical Approaches.- 2.7.1 Hoshen-Kopelman Method.- 2.7.2 Leath Method.- 2.7.3 Ziff Method.- 2.8 Theoretical Approaches.- 2.8.1 Deterministic Fractal Models.- 2.8.2 Series Expansion.- 2.8.3 Small-Cell Renormalization.- 2.8.4 Potts Model, Field Theory, and ? Expansion.- 2.A Appendix: The Generating Function Method.- References.- 3 Percolation II (With 20 Figures).- 3.1 Introduction.- 3.2 Anomalous Transport in Fractals.- 3.2.1 Normal Transport in Ordinary Lattices.- 3.2.2 Transport in Fractal Substrates.- 3.3 Transport in Percolation Clusters.- 3.3.1 Diffusion in the Infinite Cluster.- 3.3.2 Diffusion in the Percolation System.- 3.3.3 Conductivity in the Percolation System.- 3.3.4 Transport in Two-Component Systems.- 3.3.5 Elasticity in Two-Component Systems.- 3.4 Fractons.- 3.4.1 Elasticity.- 3.4.2 Vibrations of the Infinite Cluster.- 3.4.3 Vibrations in the Percolation System.- 3.4.4 Quantum Percolation.- 3.5 ac Transport.- 3.5.1 Lattice-Gas Model.- 3.5.2 Equivalent Circuit Model.- 3.6 Dynamical Exponents.- 3.6.1 Rigorous Bounds.- 3.6.2 Numerical Methods.- 3.6.3 Series Expansion and Renormalization Methods.- 3.6.4 Continuum Percolation.- 3.6.5 Summary of Transport Exponents.- 3.7 Multifractals.- 3.7.1 Voltage Distribution.- 3.7.2 Random Walks on Percolation.- 3.8 Related Transport Problems.- 3.8.1 Biased Diffusion.- 3.8.2 Dynamic Percolation.- 3.8.3 The Dynamic Structure Model of Ionic Glasses.- 3.8.4 Trapping and Diffusion Controlled Reactions.- References.- 4 Fractal Growth (With 4 Figures).- 4.1 Introduction.- 4.2 Fractals and Multifractals.- 4.3 Growth Models.- 4.3.1 Eden Model.- 4.3.2 Percolation.- 4.3.3 Invasion Percolation.- 4.4 Laplacian Growth Model.- 4.4.1 Diffusion Limited Aggregation.- 4.4.2 Dielectric Breakdown Model.- 4.4.3 Viscous Fingering.- 4.4.4 Biological Growth Phenomena.- 4.5 Aggregation in Percolating Systems.- 4.5.1 Computer Simulations.- 4.5.2 Viscous Fingers Experiments.- 4.5.3 Exact Results on Model Fractals.- 4.5.4 Crossover to Homogeneous Behavior.- 4.6 Crossover in Dielectric Breakdown with Cutoffs.- 4.7 Is Growth Multifractal?.- 4.8 Conclusion.- References.- 5 Fractures (With 18 Figures).- 5.1 Introduction.- 5.2 Some Basic Notions of Elasticity and Fracture.- 5.2.1 Phenomenological Description.- 5.2.2 Elastic Equations of Motion.- 5.3 Fracture as a Growth Model.- 5.3.1 Formulation as a Moving Boundary Condition Problem.- 5.3.2 Linear Stability Analysis.- 5.4 Modelisation of Fracture on a Lattice.- 5.4.1 Lattice Models.- 5.4.2 Equations and Their Boundary Conditions.- 5.4.3 Connectivity.- 5.4.4 The Breaking Rule.- 5.4.5 The Breaking of a Bond.- 5.4.6 Summary.- 5.5 Deterministic Growth of a Fractal Crack.- 5.6 Scaling Laws of the Fracture of Heterogeneous Media.- 5.7 Hydraulic Fracture.- 5.8 Conclusion.- References.- 6 Transport Across Irregular Interfaces: Fractal Electrodes, Membranes and Catalysts (With 8 Figures).- 6.1 Introduction.- 6.2 The Electrode Problem and the Constant Phase Angle Conjecture.- 6.3 The Diffusion Impedance and the Measurement of the Minkowski-Bouligand Exterior Dimension.- 6.4 The Generalized Modified Sierpinski Electrode.- 6.5 A General Formulation of Laplacian Transfer Across Irregular Surfaces.- 6.6 Electrodes, Roots, Lungs,.- 6.7 Fractal Catalysts.- 6.8 Summary.- References.- 7 Fractal Surfaces and Interfaces (With 27 Figures).- 7.1 Introduction.- 7.2 Rough Surfaces of Solids.- 7.2.1 Self-Affine Description of Rough Surfaces.- 7.2.2 Growing Rough Surfaces: The Dynamic Scaling Hypothesis.- 7.2.3 Deposition and Deposition Models.- 7.2.4 Fractures.- 7.3 Diffusion Fronts: Natural Fractal Interfaces in Solids.- 7.3.1 Diffusion Fronts of Noninteracting Particles.- 7.3.2 Diffusion Fronts in d = 3.- 7.3.3 Diffusion Fronts of Interacting Particles.- 7.3.4 Fluctuations in Diffusion Fronts.- 7.4 Fractal Fluid-Fluid Interfaces.- 7.4.1 Viscous Fingering.- 7.4.2 Multiphase Flow in Porous Media.- 7.5 Membranes and Tethered Surfaces.- 7.6 Conclusions.- References.- 8 Fractals and Experiments (With 18 Figures).- 8.1 Introduction.- 8.2 Growth Experiments: How to Make a Fractal.- 8.2.1 The Generic DLA Model.- 8.2.2 Dielectric Breakdown.- 8.2.3 Electrodeposition.- 8.2.4 Viscous Fingering.- 8.2.5 Invasion Percolation.- 8.2.6 Colloidal Aggregation.- 8.3 Structure Experiments: How to Determine the Fractal Dimension.- 8.3.1 Image Analysis.- 8.3.2 Scattering Experiments.- 8.3.3 Sacttering Formalism.- 8.4 Physical Properties.- 8.4.1 Mechanical Properties.- 8.4.2 Thermal Properties.- 8.5 Outlook.- References.- 9 Cellular Automata (With 6 Figures).- 9.1 Introduction.- 9.2 A Simple Example.- 9.3 The Kauffman Model.- 9.4 Classification of Cellular Automata.- 9.5 Recent Biologically Motivated Developments.- 9.A Appendix.- 9.A.1 Q2R Approximation for Ising Models.- 9.A.2 Immunologically Motivated Cellular Automata.- 9.A.3 Hydrodynamic Cellular Automata.- References.- 10 Exactly Self-similar Left-sided Multifractals with new Appendices B and C by Rudolf H. Riedi and Benoit B. Mandelbrot (With 10 Figures).- 10.1 Introduction.- 10.1.1 Two Distinct Meanings of Multifractality.- 10.1.2 ""Anomalies"".- 10.2 Nonrandom Multifractals with an Infinite Base.- 10.3 Left-sided Multifractality with Exponential Decay of Smallest Probability.- 10.4 A Gradual Crossover from Restricted to Left-sided Multifractals.- 10.5 Pre-asymptotics.- 10.5.1 Sampling of Multiplicatively Generated Measures by a Random Walk.- 10.5.2 An ""Effective"" f(?).- 10.6 Miscellaneous Remarks.- 10.7 Summary.- 10.A Details of Calculations and Further Discussions.- 10.A.1 Solution of (10.2).- 10.A.2 The Case ?min = 0.- 10.B Multifractal Formalism for Infinite Multinomial Measures, by R.H. Riedi and B.B. Mandelbrot.- 10.C The Minkowski Measure and Its Left-sided f(?), by B.B. Mandelbrot.- 10.C.1 The Minkowski Measure on the Interval [0,1].- 10.C.2 The Functions f(?) and f?(?) of the Minkowski Measure.- 10.C.3 Remark: On Continuous Models as Approximations, and on ""Thermodynamics"".- 10.C.4 Remark on the Role of the Minkowski Measure in the Study of Dynamical Systems. Parabolic Versus Hyperbolic Systems.- 10.C.5 In Lieu of Conclusion.- References.","Armin Bunde,Armin Bunde,Armin Bunde,Shlomo Havlin,Shlomo Havlin",,1991
10.1103/physrevlett.79.665,,,SPIRAL WAVE MEANDER IN EXCITABLE MEDIA : THE LARGE CORE LIMIT,We show that the dynamics of spiral waves in excitable media can be reduced to a nonlinear equation of motion for the wave tip that is asymptotically exact in a parameter range where the motion takes place around a large central core region. The onset of meander is shown to occur naturally in this range in the usual free-boundary limit where the medium exhibits an abrupt response to a stimulus. This equation provides a simple understanding of the physical origin of the meandering instability of spiral waves and of the quasiperiodic motion of the wave tip.,"Vincent Hakim,Vincent Hakim,Alain Karma,Alain Karma",Physical Review Letters,1997
