DOI,PMID,arXiv ID,Title,Abstract,Authors,Journal,Year
10.1103/physrevlett.76.4285,10061248,,Dynamics of a traveling density wave model for earthquakes.,"We propose a unifying new framework for friction and earthquakes. Predictions from theory include (1) scaling exponents, and (2) metastable lifetimes for nucleating slip droplets. Earthquake simulations produce Gutenberg-Richter distributions of events with b values similar to observed declustered values, and populations of characteristic earthquakes, with associated aftershocks. Time is a relevant scaling field, justifying statistical time-to-failure analyses. When applied to integrate-and-fire neurons, the theory yields an explicit equation for the cell potential.","John B. Rundle,John B. Rundle,Wolfgang Klein,William Klein,Susanna Gross,Susanna Gross",Physical Review Letters,1996
10.1103/physrevlett.76.940,10061590,,Simplest possible self-organized critical system.,"In order to pinpoint the nature of self-organized criticality, a simplest possible system exhibiting the phenomenon is introduced and analyzed. Its phase space is fully parametrized by two integer variables, one describing the state of a medium (sandpile), the other describing the state of a disturbance (avalanche) propagating in the medium, modifying it in the process. For asymptotically large systems, a scaling limit is obtained in which the system's state and dynamics is given by two real numbers and a simple partial differential equation. These results provide a full and transparent description of the dynamics that drives this system critical and keeps it in that state.","Henrik Flyvbjerg,Henrik Flyvbjerg",Physical Review Letters,1996
10.1103/physreve.51.1711,9962830,,Renormalization approach to the self-organized critical behavior of sandpile models.,"We introduce a renormalization scheme of a type that is able to describe the self-organized critical state (SOC) of sandpile models. We have defined a characterization of the phase space that allows us to study the evolution of the dynamics under change of scale. In addition, a stationarity condition provides a feedback mechanism that drives the system to its critical state. We obtain an attractive fixed point in the phase space of the parameters that clarifies the self-organized critical nature of these systems. The universality class of several models is identified by studying the properties of the basin of attraction of this fixed point. We compute analytically the avalanche exponent \ensuremath{\tau} and the dynamical exponent z for sandpile models in d=2. The values obtained are in very good agreement with computer simulations. The renormalization scheme can also be applied to study nonconservative sandpile models. The result is that the introduction of a dissipation parameter destroys the critical properties as suggested from simulations. The present theoretical framework seems particularly suitable for all SOC problems and can be naturally extended to other systems showing a critical nonequilibrium stationary state.","Alessandro Vespignani,Alessandro Vespignani,Stefano Zapperi,Stefano Zapperi,L. Pietronero,Luciano Pietronero,Luciano Pietronero",Physical Review E,1995
10.1016/0167-2789(86)90007-2,,,Spiral waves in the Belousov-Zhabotinskii reaction,"Abstract   The beautiful spiral waves of oxidation in the Belousov-Zhabotinskii reaction are the source of many interesting and important questions about periods structures in excitable media. It has long been known that these spirals are similar to involutes of circles, at least some distance from the center, but until now, no way has been known to determine the correct wavelength and frequency. In this paper, we show that the parameters of a spiral wave can be viwed s eigenvalues of a problem with unique solution. The critical ingredients of the theory are the effects of curvature on the propagation of wavefronts in two-dimensional media, and the dispersion of plane waves Our analytical results are shown to be in good agreement with experimental data for the Belousov-Zhabotinskii reagent.","James P. Keener,James P. Keener,John J. Tyson,John J. Tyson",Physica D: Nonlinear Phenomena,1986
10.1063/1.1348335,,,Collective modes in a strongly coupled dusty plasma,"It is widely recognized that in a typical dusty plasma encountered in the laboratory or outer space, the dust component is in a strongly coupled state because the interaction energy of neighboring dust particles due to shielded Coulomb (“Yukawa”) forces is much larger than their thermal energy. Low frequency collective modes involving the motion of dust particles are therefore greatly influenced by the strong correlation effects in the dust component. In this paper a dispersion relation for low-frequency collective modes using a generalized hydrodynamics model for the dust component has been derived. Strong correlation effects are described in terms of viscoelastic transport coefficients and a finite relaxation time for the memory kernel. Novel collective effects such as new corrections to dispersion terms for longitudinal dust acoustic waves and the existence of transverse shear waves supported by strong correlations have been identified. New physical processes involving nonuniform charge number equilibr...","P. K. Kaw,P. K. Kaw",Physics of Plasmas,2001
10.1103/physreva.41.4199,,,Random packing of disks in two dimensions,"The geometry of a random dense packing of disks of equal size obtained by compacting a random sequential adsorption configuration is discussed. The configuration is shown to be without any long-ranged order, and no local configurations of ordered domains were found. The fraction of area covered by disks is {theta}=0.772{plus minus}0.002, and the number of contacts per disk are 3.02{plus minus}0.03. It is argued that this random packing is a stable configuration close to the random loose-packed limit in two dimensions. The packing fraction of the compacted packing is close to a prediction we make of {theta}=0.78 for a random loose-packed configuration. Several statistical distributions calculated from the limiting geometry is studied. Both the area and circumference distributions of the Voronoi-Dirichlet polygons could be fitted to {Gamma} distribution functions.","Einar L. Hinrichsen,Einar L. Hinrichsen,Jens Feder,Jens Feder,Torstein Jøssang,Torstein Jøssang",Physical Review A,1990
10.1103/physrevlett.76.3368,10060949,,Critical behavior of the sandpile model as a self-organized branching process.,"Kinetic equations, which explicitly take into account the branching nature of sandpile avalanches, are derived. The dynamics of the sandpile model is described by the generating functions of a branching process. Having used the results obtained the renormalization group approach to the critical behavior of the sandpile model is generalized in order to calculate both critical exponents and height probabilities.","Ė. V. Ivashkevich,Ivashkevich Ev,E. V. Ivashkevich",Physical Review Letters,1996
